{
  "schema": "walletwall.pq-proof-artifact.v1",
  "generatedAt": "2026-01-01T00:00:00.000Z",
  "artifact": {
    "kind": "sp1-mldsa65-journal-manifest",
    "vectorSet": "library-generated/ml-dsa-65",
    "verifier": {
      "name": "walletwall-vault-pq-verifier",
      "version": "0.1.0"
    },
    "tooling": {
      "prover": "sp1",
      "scheme": "groth16"
    },
    "sourceEvidenceHash": "0xf8e5e329229a7287572d8033c269b889cf6ff7a01497486cd501d594b845ecd8",
    "input": {
      "messageHash": "0x736040b98747745e98dbbeb459df3c6f5dc3d89fd305bccade65d2807cb0530c",
      "publicKeyHash": "0x3ae18e10835136b3f369b331045bd230caefed3e5c32a3bd0be523a5ccda12f0",
      "signatureHash": "0x3ad471f5c1048bfc22a707479e3f827bd032da80870c98fbdef2b964ad50caed"
    },
    "journal": {
      "publicValues": "0x8e345eeac3d258c778ad2384da5952dd41734c24c4912cc168899b54ac24e9863ae18e10835136b3f369b331045bd230caefed3e5c32a3bd0be523a5ccda12f03ad471f5c1048bfc22a707479e3f827bd032da80870c98fbdef2b964ad50caed0000000000000000000000000000000000000000000000000000000000007a690000000000000000000000001111111111111111111111111111111111111111",
      "publicValuesHash": "0x87f2c4dff1a8b21209e06f0710c2afdf3614310badb15d929af04856126c7c4c",
      "chainId": 31337,
      "verifierAddress": "0x1111111111111111111111111111111111111111"
    }
  },
  "proof": {
    "status": "gated",
    "scheme": "groth16",
    "generated": false,
    "reason": "Heavy SP1 Groth16 proving is gated behind RUN_SP1_E2E=1 and an external prover; not produced in CI. This manifest pins the deterministic journal only."
  },
  "regeneration": {
    "command": "npm run proof:artifact",
    "deterministic": true
  }
}
